{"artifact_metadata":{"classification":"SYNTHETIC_FIXTURE","evidence_claim":"NOT_EVIDENCE_OR_PASS","fixture_notice":"SYNTHETIC EXAMPLE ONLY; NOT EVIDENCE; NOT A PASS VERDICT"},"authority_effect":"NONE","candidate_id":null,"closing_gate":"M0","created_at":"2026-05-01T00:00:01Z","creation_provenance":{"execution_authorization_evaluation_ref":null,"mode":"M0_P_CUSTODY_INDEX"},"predecessor_scope_ref":null,"revision":1,"schema":"ylx.stage-source-scope.v1","scope_id":"fixture-m0-baseline-scope","scope_kind":"M0_BASELINE","source_ref_by_id":{"acceptance-registry":{"authority_effect":"NONE","locator":"docs/acceptance-requirements.yaml","observed_at":"2026-05-01T00:00:00Z","provenance":"M0-P custody observation of already-held repository bytes.","ref_id":"acceptance-registry","sha256":"1bc8fe5a1ccedecf1277be24aae654882a48f28f83ad918fde87adc64568f30f","source_kind":"ALREADY_HELD_LOCAL_BYTES"},"system-feature-mapping":{"authority_effect":"NONE","locator":"docs/system-requirement-mapping.yaml","observed_at":"2026-05-01T00:00:00Z","provenance":"M0-P custody observation of already-held repository bytes.","ref_id":"system-feature-mapping","sha256":"14a671e9f6345f092f4b184d6ca67555e0713fca785798758313b6ac1874da39","source_kind":"ALREADY_HELD_LOCAL_BYTES"}},"source_sha256_by_id":{"acceptance-registry":"1bc8fe5a1ccedecf1277be24aae654882a48f28f83ad918fde87adc64568f30f","system-feature-mapping":"14a671e9f6345f092f4b184d6ca67555e0713fca785798758313b6ac1874da39"}}