{"artifact_metadata":{"classification":"SYNTHETIC_FIXTURE","evidence_claim":"NOT_EVIDENCE_OR_PASS","fixture_notice":"SYNTHETIC EXAMPLE ONLY; NOT EVIDENCE; NOT A PASS VERDICT"},"authority_effect":"NONE","candidate_id":null,"closing_gate":"M1","created_at":"2026-06-01T12:04:40Z","creation_provenance":{"execution_authorization_evaluation_ref":{"artifact_id":"fixture-execution-evaluation-m1-stage-source-scope-creation-pass","artifact_path":"contracts/fixtures/governance-models/valid/execution-authorization-evaluation-m1-stage-source-scope-creation-pass.json","artifact_sha256":"7b231acbb4063bf70699526231a14e695e5b9151048e5998f13d28b32d32d959","schema":"ylx.execution-authorization-evaluation.v1"},"mode":"EXECUTION_AUTHORIZED_GOVERNANCE_OUTPUT"},"predecessor_scope_ref":null,"revision":1,"schema":"ylx.stage-source-scope.v1","scope_id":"fixture-m1-decision-scope","scope_kind":"M1_DECISION","source_ref_by_id":{"acceptance-registry-history-head-v1":{"artifact_id":"acceptance-registry-history-head-v1","artifact_path":"contracts/fixtures/governance-models/valid/acceptance-registry-history-head.json","artifact_sha256":"454be6a038dd21517f141df6b82754b2fb34d79d8f7d143d47e129748c73f8ef","revision":1,"schema":"ylx.acceptance-registry-history-head.v1"},"decision-history-head-v1-af67c861f93f9e79483bbd235bcb604824546247c4a8e68e8857d8c1541f7460":{"artifact_id":"decision-history-head-v1-af67c861f93f9e79483bbd235bcb604824546247c4a8e68e8857d8c1541f7460","artifact_path":"contracts/fixtures/governance-models/valid/decision-history-head.json","artifact_sha256":"e73151b9357ff61143ad703f6bb850e309a6d8337a8b0006b1f87080dc2a3a4f","revision":1,"schema":"ylx.decision-history-head.v1"}},"source_sha256_by_id":{"acceptance-registry-history-head-v1":"454be6a038dd21517f141df6b82754b2fb34d79d8f7d143d47e129748c73f8ef","decision-history-head-v1-af67c861f93f9e79483bbd235bcb604824546247c4a8e68e8857d8c1541f7460":"e73151b9357ff61143ad703f6bb850e309a6d8337a8b0006b1f87080dc2a3a4f"}}